{
  "$schema": "https://json-schema.org/draft/2020-12/schema",
  "$id": "runtime-contracts/external-ai/request.schema.json",
  "title": "ExternalAiDecisionRequest",
  "type": "object",
  "required": [
    "request_id",
    "session_id",
    "seat",
    "player_id",
    "decision_name",
    "request_type",
    "fallback_policy",
    "public_context",
    "legal_choices",
    "transport",
    "worker_contract_version",
    "required_capabilities"
  ],
  "properties": {
    "request_id": { "type": "string", "minLength": 1 },
    "session_id": { "type": "string", "minLength": 1 },
    "seat": { "type": "integer", "minimum": 1 },
    "player_id": { "type": ["integer", "string"], "minimum": 1, "minLength": 1 },
    "player_id_alias_role": {
      "type": "string",
      "enum": ["legacy_compatibility_alias"]
    },
    "primary_player_id": { "type": ["integer", "string"], "minimum": 1, "minLength": 1 },
    "primary_player_id_source": {
      "type": "string",
      "enum": ["public", "protocol", "legacy"]
    },
    "legacy_player_id": { "type": "integer", "minimum": 1 },
    "public_player_id": { "type": "string", "minLength": 1 },
    "seat_id": { "type": "string", "minLength": 1 },
    "viewer_id": { "type": "string", "minLength": 1 },
    "decision_name": { "type": "string", "minLength": 1 },
    "request_type": { "type": "string", "minLength": 1 },
    "fallback_policy": { "type": "string", "minLength": 1 },
    "public_context": {
      "type": "object",
      "additionalProperties": true
    },
    "legal_choices": {
      "type": "array",
      "items": {
        "type": "object",
        "required": ["choice_id"],
        "properties": {
          "choice_id": { "type": "string", "minLength": 1 },
          "title": { "type": "string" },
          "description": { "type": "string" },
          "value": { "type": ["object", "boolean", "number", "string", "null"], "additionalProperties": true }
        },
        "additionalProperties": true
      }
    },
    "transport": {
      "type": "string",
      "enum": ["http", "loopback"]
    },
    "worker_contract_version": {
      "type": "string",
      "minLength": 1
    },
    "required_capabilities": {
      "type": "array",
      "items": {
        "type": "string",
        "minLength": 1
      }
    }
  },
  "additionalProperties": true
}
