{
  "request_id": "sess_ext_2_ext_move01",
  "session_id": "sess_ext_2",
  "seat": 3,
  "player_id": 3,
  "player_id_alias_role": "legacy_compatibility_alias",
  "primary_player_id": 3,
  "primary_player_id_source": "legacy",
  "decision_name": "choose_movement",
  "request_type": "movement",
  "fallback_policy": "ai",
  "public_context": {
    "round_index": 3,
    "turn_index": 2,
    "player_cash": 14,
    "player_position": 5,
    "player_shards": 1
  },
  "legal_choices": [
    {
      "choice_id": "dice",
      "title": "Roll dice",
      "value": {
        "use_cards": false,
        "card_values": []
      }
    },
    {
      "choice_id": "card_2",
      "title": "Use card 2",
      "value": {
        "use_cards": true,
        "card_values": [2]
      }
    },
    {
      "choice_id": "card_2_5",
      "title": "Use cards 2+5",
      "value": {
        "use_cards": true,
        "card_values": [2, 5]
      }
    }
  ],
  "transport": "http",
  "worker_contract_version": "v1",
  "required_capabilities": ["choice_id_response"]
}
